{
  "profile_version": 1,
  "id": "privacy",
  "name": "Privacy",
  "description": "Strict privacy & anti-AI profile (~47 tweaks): disables Copilot/Recall/Click-to-Do/Paint/Notepad/Edge AI, sets background services to Manual, blocks BIOS WPBT & Cloud Consumer Features, and removes telemetry tasks.",
  "bundles": [
    "copilot_disable",
    "recall_disable",
    "click_to_do_disable",
    "paint_ai_disable",
    "notepad_ai_disable",
    "edge_ai_disable",
    "remove_ai_hub_and_devhome",
    "telemetry_minimal",
    "diagtrack_service_disable",
    "dmwappushservice_disable",
    "set_nonessential_services_manual",
    "disable_extra_telemetry_tasks",
    "disable_consumer_features_cloud_content",
    "disable_background_uwp_apps",
    "bing_lock_and_suggestions_disable",
    "activity_history_disable",
    "location_tracking_disable",
    "find_my_device_disable",
    "tailored_experiences_and_ink_disable",
    "app_launch_tracking_disable",
    "settings_365_ads_and_home_disable",
    "edge_ads_and_msn_feed_disable",
    "bing_search_disable",
    "store_search_suggestions_disable",
    "widgets_disable",
    "win10_news_and_interests_disable",
    "taskbar_hide_chat_meetnow",
    "start_disable_recommended",
    "start_disable_phone_link",
    "explorer_show_extensions_and_hidden",
    "stop_edge_pdf_hijack",
    "wu_no_auto_reboot_logged_on",
    "wu_disable_delivery_optimization_p2p",
    "disable_device_auto_app_download",
    "disable_wpbt_bios_injection",
    "block_razer_logitech_auto_install",
    "remove_clipchamp",
    "remove_bing_news_weather",
    "remove_bing_suite_extra",
    "remove_solitaire_casual",
    "remove_outlook_new_and_teams_consumer",
    "remove_cortana_and_tips",
    "remove_3d_and_mixed_reality",
    "remove_office_hub_and_companions",
    "remove_power_automate_and_pc_manager",
    "remove_skype_people_messaging_mail",
    "remove_third_party_sponsored_bloat"
  ]
}
