{
  "profile_version": 1,
  "id": "gamer",
  "name": "Gamer",
  "description": "Low-latency gaming & power-user profile (~45 tweaks): disables Game DVR, mouse acceleration, Sticky Keys, BIOS WPBT bloat, Razer/Logitech auto-installers, and sets non-essential services to Manual while keeping Xbox Identity intact.",
  "bundles": [
    "copilot_disable",
    "recall_disable",
    "click_to_do_disable",
    "paint_ai_disable",
    "notepad_ai_disable",
    "edge_ai_disable",
    "telemetry_minimal",
    "set_nonessential_services_manual",
    "disable_extra_telemetry_tasks",
    "disable_consumer_features_cloud_content",
    "bing_lock_and_suggestions_disable",
    "app_launch_tracking_disable",
    "settings_365_ads_and_home_disable",
    "edge_ads_and_msn_feed_disable",
    "bing_search_disable",
    "widgets_disable",
    "win10_news_and_interests_disable",
    "taskbar_hide_chat_meetnow",
    "taskbar_enable_end_task",
    "taskbar_last_active_click",
    "classic_context_menu",
    "explorer_show_extensions_and_hidden",
    "explorer_show_hidden_files",
    "explorer_launch_to_this_pc",
    "explorer_disable_drag_tray",
    "enable_win32_long_paths",
    "disable_explorer_auto_folder_discovery",
    "dark_theme_enable",
    "disable_transparency",
    "disable_animations",
    "alt_tab_hide_edge_tabs",
    "always_show_scrollbars",
    "enable_verbose_bsod_and_logon",
    "disable_sticky_keys_prompt",
    "disable_mouse_acceleration",
    "disable_game_dvr_and_bar",
    "wu_no_auto_reboot_logged_on",
    "wu_disable_delivery_optimization_p2p",
    "disable_device_auto_app_download",
    "disable_wpbt_bios_injection",
    "block_razer_logitech_auto_install",
    "remove_clipchamp",
    "remove_bing_news_weather",
    "remove_bing_suite_extra",
    "remove_solitaire_casual",
    "remove_cortana_and_tips",
    "remove_3d_and_mixed_reality",
    "remove_office_hub_and_companions",
    "remove_third_party_sponsored_bloat"
  ]
}
