{
  "profile_version": 1,
  "id": "enterprise",
  "name": "Enterprise",
  "description": "Workstation & fleet hardening (~54 tweaks): disables consumer AI/Recall payloads, blocks WPBT & Consumer Features, enables Win32 Long Paths & Verbose BSoD/Logon, sets non-essential services to Manual, and removes all consumer/OEM bloatware.",
  "bundles": [
    "copilot_disable",
    "recall_disable",
    "recall_capability_remove",
    "click_to_do_disable",
    "paint_ai_disable",
    "notepad_ai_disable",
    "edge_ai_disable",
    "remove_ai_hub_and_devhome",
    "telemetry_minimal",
    "diagtrack_service_disable",
    "dmwappushservice_disable",
    "set_nonessential_services_manual",
    "disable_extra_telemetry_tasks",
    "disable_consumer_features_cloud_content",
    "bing_lock_and_suggestions_disable",
    "activity_history_disable",
    "tailored_experiences_and_ink_disable",
    "app_launch_tracking_disable",
    "settings_365_ads_and_home_disable",
    "edge_ads_and_msn_feed_disable",
    "bing_search_disable",
    "store_search_suggestions_disable",
    "widgets_disable",
    "win10_news_and_interests_disable",
    "taskbar_hide_chat_meetnow",
    "start_disable_recommended",
    "start_disable_phone_link",
    "taskbar_enable_end_task",
    "explorer_show_extensions_and_hidden",
    "explorer_launch_to_this_pc",
    "explorer_hide_duplicate_removable_drives",
    "enable_win32_long_paths",
    "disable_explorer_auto_folder_discovery",
    "stop_edge_pdf_hijack",
    "enable_verbose_bsod_and_logon",
    "wu_no_auto_reboot_logged_on",
    "wu_disable_delivery_optimization_p2p",
    "wu_disable_latest_updates_asap",
    "disable_device_auto_app_download",
    "disable_wpbt_bios_injection",
    "block_razer_logitech_auto_install",
    "wordpad_capability_remove",
    "remove_steps_recorder_and_math_input",
    "remove_clipchamp",
    "remove_bing_news_weather",
    "remove_bing_suite_extra",
    "remove_solitaire_casual",
    "remove_outlook_new_and_teams_consumer",
    "remove_cortana_and_tips",
    "remove_3d_and_mixed_reality",
    "remove_office_hub_and_companions",
    "remove_power_automate_and_pc_manager",
    "remove_skype_people_messaging_mail",
    "remove_third_party_sponsored_bloat",
    "remove_oem_bloatware_hp_dell_lenovo"
  ]
}
